load,id,title,slug,excerpt,content,author,date,readTime,categories,featuredImage,featured
TRUE,1,"A Brief History of the Ottoman Empire","ottoman-empire-history","Explore the rise and fall of the Ottoman Empire, a significant power shaping global history.","<p>The Ottoman Empire was one of history's longest-lasting empires, ruling large territories across Europe, Asia, and Africa for over six centuries.</p>","John Historian","2023-10-15","8 min read","history","https://picsum.photos/800/600?random=1",TRUE
TRUE,2,"The Importance of Monthly Budgeting","importance-of-monthly-budgeting","Understand why monthly budgeting is essential for financial stability and achieving your goals.","<p>Monthly budgeting helps individuals control their finances, save money, and plan effectively for the future.</p>","Emily Finance","2023-09-20","10 min read","personalfinance","https://picsum.photos/id/1018/1000/600",FALSE
TRUE,3,"Peace in the Middle East Means Global Peace","middle-east-global-peace","Discover why achieving peace in the Middle East could have profound global implications.","<p>Resolving conflicts in the Middle East could significantly stabilize global politics, economy, and security.</p>","Mark Global","2023-08-15","12 min read","globalaffairs","https://picsum.photos/id/1025/1000/600",FALSE
TRUE,4,"Simplifying Life with Spreadsheets","spreadsheets-simplify-life","Learn how using spreadsheets can dramatically simplify personal organization and productivity.","<p>Spreadsheets aren't just for businesses. They can simplify everyday tasks, budgets, plans, and schedules for anyone.</p>","Anna Organizer","2023-08-05","9 min read","spreadsheets","https://picsum.photos/id/1035/1000/600",TRUE
TRUE,5,"Why Investing Matters at Any Age","investing-matters-any-age","Investing is crucial at every life stage—learn why starting early or late can still greatly benefit you.","<p>No matter your age, investing provides opportunities to build wealth, secure your future, and achieve financial independence.</p>","Jake Investor","2023-06-25","7 min read","personalfinance","https://picsum.photos/id/1039/1000/600",FALSE